{"description":"Sells the owner's entire balance of a token once it exceeds a threshold.","display":{"summary":"Trade above threshold: sell all {{sellToken}} once balance exceeds {{threshold|amount(sellToken)}}"},"errors":{"0x00b8f216":{"label":"Balance is at or below the threshold","name":"BalanceInsufficient"},"0x0af806e0":{"label":"Proposed order does not match the generated order","name":"InvalidHash"}},"extensions":{},"links":{"source":"https://github.com/nullislabs/composable-cow/blob/develop/src/types/TradeAboveThreshold.sol"},"name":"TradeAboveThreshold","offchainInput":{"required":false},"staticInput":{"components":[{"name":"sellToken","type":"address"},{"name":"buyToken","type":"address"},{"name":"receiver","type":"address"},{"name":"validityBucketSeconds","type":"uint32"},{"name":"threshold","type":"uint256"},{"name":"appData","type":"bytes32"}]},"version":"1"}
