{"description":"Perpetually swaps between two stable tokens in whichever direction the owner currently holds a balance.","display":{"summary":"Perpetual stable swap between {{tokenA}} and {{tokenB}}"},"errors":{"0x0af806e0":{"label":"Proposed order does not match the generated order","name":"InvalidHash"},"0xd5ef09ba":{"label":"No balance in either token","name":"NotFunded"}},"extensions":{},"links":{"source":"https://github.com/nullislabs/composable-cow/blob/develop/src/types/PerpetualStableSwap.sol"},"name":"PerpetualStableSwap","offchainInput":{"required":false},"staticInput":{"components":[{"name":"tokenA","type":"address"},{"name":"tokenB","type":"address"},{"name":"validityBucketSeconds","type":"uint32"},{"name":"halfSpreadBps","type":"uint256"},{"name":"appData","type":"bytes32"}]},"version":"1"}
