{"description":"Sells after a start time, sizing the buy amount from an off-chain price checker and the owner's balance.","display":{"summary":"Good after time: sell {{sellAmount|amount(sellToken)}} from {{startTime|datetime}}"},"errors":{"0x00b8f216":{"label":"Owner balance is below the sell amount","name":"BalanceInsufficient"},"0x085de625":{"label":"Not yet valid","name":"TooEarly"},"0x0af806e0":{"label":"Proposed order does not match the generated order","name":"InvalidHash"},"0x1f2a2005":{"label":"Sell or buy amount is zero","name":"ZeroAmount"},"0xc65554aa":{"label":"Price checker rejected the order","name":"PriceCheckerFailed"}},"extensions":{},"links":{"source":"https://github.com/nullislabs/composable-cow/blob/develop/src/types/GoodAfterTime.sol"},"name":"GoodAfterTime","offchainInput":{"required":true},"staticInput":{"components":[{"name":"sellToken","type":"address"},{"name":"buyToken","type":"address"},{"name":"receiver","type":"address"},{"name":"sellAmount","type":"uint256"},{"name":"minSellBalance","type":"uint256"},{"name":"startTime","type":"uint256"},{"name":"endTime","type":"uint256"},{"name":"allowPartialFill","type":"bool"},{"name":"priceCheckerPayload","type":"bytes"},{"name":"appData","type":"bytes32"}]},"version":"1"}
