{"description":"Sells once a Chainlink-derived price crosses a strike, with staleness and expiry guards.","display":{"summary":"Stop loss: sell {{sellAmount|amount(sellToken)}} when price crosses {{strike}}"},"errors":{"0x0af806e0":{"label":"Proposed order does not match the generated order","name":"InvalidHash"},"0x1f2a2005":{"label":"Sell or buy amount is zero","name":"ZeroAmount"},"0x300f64c4":{"label":"Price has not crossed the strike","name":"StrikeNotReached"},"0xa9f73445":{"label":"Oracle price is stale","name":"OracleStalePrice"},"0xc56873ba":{"label":"Order validity window has passed","name":"OrderExpired"},"0xc969c593":{"label":"Oracle returned an invalid price","name":"OracleInvalidPrice"}},"extensions":{},"links":{"source":"https://github.com/nullislabs/composable-cow/blob/develop/src/types/StopLoss.sol"},"name":"StopLoss","offchainInput":{"required":false},"staticInput":{"components":[{"name":"sellToken","type":"address"},{"name":"buyToken","type":"address"},{"name":"sellAmount","type":"uint256"},{"name":"buyAmount","type":"uint256"},{"name":"appData","type":"bytes32"},{"name":"receiver","type":"address"},{"name":"isSellOrder","type":"bool"},{"name":"isPartiallyFillable","type":"bool"},{"name":"validTo","type":"uint32"},{"name":"sellTokenPriceOracle","type":"address"},{"name":"buyTokenPriceOracle","type":"address"},{"name":"strike","type":"int256"},{"name":"maxTimeSinceLastOracleUpdate","type":"uint256"}]},"version":"1"}
