{"description":"Sells a fixed amount in n equal parts at a fixed interval, optionally restricted to a span within each interval.","display":{"summary":"TWAP: sell {{partSellAmount|amount(sellToken)}} x {{n}} every {{t|duration}}"},"errors":{"0x0af806e0":{"label":"Proposed order does not match the generated order","name":"InvalidHash"},"0x295964ea":{"label":"Part sell amount is zero","name":"InvalidPartSellAmount"},"0x453ffb60":{"label":"Waiting for the start time to be recorded","name":"OrderNotInitialized"},"0x6cdfb5fe":{"label":"Minimum part limit is zero","name":"InvalidMinPartLimit"},"0x8ccc2bc9":{"label":"All parts complete","name":"AfterTwapFinish"},"0x92b12081":{"label":"Number of parts is invalid","name":"InvalidNumParts"},"0xb290253c":{"label":"Start time is invalid","name":"InvalidStartTime"},"0xc1ab6dc1":{"label":"Token address is zero","name":"InvalidToken"},"0xda09e34a":{"label":"Sell and buy token are the same","name":"InvalidSameToken"},"0xe3c2448f":{"label":"Interval is invalid","name":"InvalidFrequency"},"0xebab1062":{"label":"Not started yet","name":"BeforeTwapStart"},"0xef98fad7":{"label":"Span exceeds the interval","name":"InvalidSpan"},"0xf79955c7":{"label":"Outside today's trading window","name":"NotWithinSpan"}},"extensions":{},"links":{"source":"https://github.com/nullislabs/composable-cow/blob/develop/src/types/twap/TWAP.sol"},"name":"TWAP","offchainInput":{"required":false},"staticInput":{"components":[{"name":"sellToken","type":"address"},{"name":"buyToken","type":"address"},{"name":"receiver","type":"address"},{"name":"partSellAmount","type":"uint256"},{"name":"minPartLimit","type":"uint256"},{"name":"t0","type":"uint256"},{"name":"n","type":"uint256"},{"name":"t","type":"uint256"},{"name":"span","type":"uint256"},{"name":"appData","type":"bytes32"}]},"version":"1"}
